"key","displayName","scientificName","familyOrCropGroup","growthForm","patternType","modelType","referenceZoneCode","startMonth","startDay","durationDays","triggerSignals","supportsHemisphereShift","supportsUsdaShift","pollinationRequirement","selfCompatibility","pollinationMode","preferredLearningSignals","researchStatus","researchNoteId","lastReviewedDate","uncertaintyNote","checklist_identityCaptured","checklist_aliasesReviewed","checklist_patternChosen","checklist_modelChosen","checklist_baselineTimingRecorded","checklist_pollinationDecisionRecorded","checklist_uncertaintyLogged","checklist_researchNoteLinked","checklist_cultivarAuditStarted","checklist_testsPresent","checklist_status","timedCultivarCount","catalogOnlyCultivarCount","pollinationOverrideCultivarCount"
"sapodilla","Sapodilla","Manilkara zapota","Sapotaceae","tree","SINGLE_ANNUAL","CLIMATE_WINDOW","10b","4","1","45","spring_heat|warm_season","true","true","UNKNOWN","UNKNOWN","UNKNOWN","BUD|BLOOM|FRUIT_SET|HARVEST","reviewed","tropical-catalog-backfill-research.md","2026-03-30","Pollination detail is inconsistent across sources; keep timing coarse and let local history outrank the baseline.","true","true","true","true","true","true","true","true","true","true","reviewed","0","0","0"
"sour cherry","Sour Cherry","Prunus cerasus","Rosaceae / stone fruit","tree","SINGLE_ANNUAL","CLIMATE_WINDOW","7a","3","28","10","chill|spring_heat","true","true","SELF_FERTILE","SELF_FERTILE","SELF_POLLINATING","BUD|BLOOM|FRUIT_SET|HARVEST","reviewed","stonefruit-bloom-research.md","2026-03-30","Sour cherries are commonly self-fruitful, but spring weather and nearby pollinizers can still shift the real crop quality away from the nominal bloom lane.","true","true","true","true","true","true","true","true","true","true","reviewed","1","0","0"
"soursop","Soursop","Annona muricata","Annonaceae","tree","SINGLE_ANNUAL","CLIMATE_WINDOW","10b","4","1","90","spring_heat|warm_season","true","true","CROSS_POLLINATION_RECOMMENDED","PARTIAL","INSECT","BUD|BLOOM|FRUIT_SET|HARVEST","reviewed","tropical-catalog-backfill-research.md","2026-03-30","Soursop flowering is warm-season driven, but pollination detail and flush strength still vary enough that the generic window should stay conservative.","true","true","true","true","true","true","true","true","true","true","reviewed","4","0","0"
"star fruit","Star Fruit","Averrhoa carambola","Oxalidaceae","tree","MULTI_WAVE","TROPICAL_REPEAT","10b","4","15","50","warm_season|rainfall","true","true","CROSS_POLLINATION_RECOMMENDED","PARTIAL","INSECT","BUD|BLOOM|FRUIT_SET|HARVEST","reviewed","star-fruit-research.md","2026-03-30","Star fruit often flowers in repeated flushes, but cultivar fertility and flush strength vary enough that local observations should outrank the baseline.","true","true","true","true","true","true","true","true","true","true","reviewed","25","0","8"
"strawberry","Strawberry","Fragaria x ananassa","Rosaceae / berry","herbaceous","SINGLE_ANNUAL","CLIMATE_WINDOW","7a","4","10","25","chill|spring_heat","true","true","SELF_FERTILE","SELF_FERTILE","SELF_POLLINATING","BUD|BLOOM|FRUIT_SET|HARVEST","reviewed","pome-berry-bloom-research.md","2026-03-30","Cultivated strawberries are self-fertile, but pollinator activity still affects berry fullness enough that the seasonal window should stay coarse.","true","true","true","true","true","true","true","true","true","true","reviewed","0","0","0"
"sugar apple","Sugar Apple","Annona squamosa","Annonaceae","tree","SINGLE_ANNUAL","CLIMATE_WINDOW","10b","3","15","95","spring_heat|warm_season","true","true","CROSS_POLLINATION_RECOMMENDED","PARTIAL","INSECT","BUD|BLOOM|FRUIT_SET|HARVEST","reviewed","sugar-apple-research.md","2026-03-30","Natural set can be weak and hand pollination often changes outcomes, so the species window is more useful as a watch period than a precise forecast.","true","true","true","true","true","true","true","true","true","true","reviewed","28","0","1"
"sweet cherry","Sweet Cherry","Prunus avium","Rosaceae / stone fruit","tree","SINGLE_ANNUAL","CLIMATE_WINDOW","7a","3","24","10","chill|spring_heat","true","true","NEEDS_CROSS_POLLINATION","SELF_STERILE","HAND_HELPFUL","BUD|BLOOM|FRUIT_SET|HARVEST","reviewed","stonefruit-bloom-research.md","2026-03-30","Most sweet cherries need pollinizers, but self-fertile exceptions and regional chill differences make the generic bloom lane intentionally conservative.","true","true","true","true","true","true","true","true","true","false","reviewed","5","0","2"
"tamarind","Tamarind","Tamarindus indica","Fabaceae","tree","SINGLE_ANNUAL","CLIMATE_WINDOW","10b","5","15","100","spring_heat|warm_season","true","true","NEEDS_CROSS_POLLINATION","SELF_STERILE","HAND_HELPFUL","BUD|BLOOM|FRUIT_SET|HARVEST","reviewed","tamarind-research.md","2026-03-30","Pollination guidance is stronger than the exact bloom calendar here; warm-season timing can still drift by climate and tree vigor.","true","true","true","true","true","true","true","true","true","true","reviewed","25","0","0"
"white sapote","White Sapote","Casimiroa edulis","Rutaceae","tree","SINGLE_ANNUAL","CLIMATE_WINDOW","10b","11","15","170","spring_heat|warm_season","true","true","CROSS_POLLINATION_RECOMMENDED","PARTIAL","INSECT","BUD|BLOOM|FRUIT_SET|HARVEST","reviewed","white-sapote-research.md","2026-03-30","Pollination is cultivar-dependent and sources conflict, so the long bloom season should be treated as a coarse watch window.","true","true","true","true","true","true","true","true","true","true","reviewed","13","0","6"
